{
  "cost": {
    "baseEstimatedUsd": 12.8,
    "conservativeEstimatedUsd": 19.2,
    "maxSpendUsd": 24.0
  },
  "planDigest": "45eb57209615b899504e6b316ad09c3e5067d04c00c77d83676fe788756e1db9",
  "profile": {
    "aspectRatio": "16:9",
    "compressionQuality": "optimized",
    "durationSeconds": 8,
    "enhancePrompt": true,
    "fps": 24,
    "generateAudio": false,
    "modelId": "veo-3.1-fast-generate-001",
    "personGeneration": "allow_adult",
    "profileId": "final-fast-1080p",
    "resolution": "1080p",
    "sampleCount": 1
  },
  "projectId": "the-glitch-is-me",
  "schemaVersion": "1.0.0",
  "shots": [
    {
      "aspectRatio": "16:9",
      "chapterId": "digital-ocean",
      "durationSeconds": 8,
      "estimatedCostUsd": 0.8,
      "generateAudio": false,
      "modelId": "veo-3.1-fast-generate-001",
      "negativePrompt": "visible words, captions, subtitles, interface text, logos, watermarks, generic neon cyberpunk city, cyberpunk armor, chrome robot, literal computer monitor UI, singing mouth close-up, lip synchronization, dialogue, microphones with brand marks, extra limbs, malformed hands, duplicated face, face morphing, child, teenager, nudity, sexualized framing, gore, horror monster, jump scare, frantic handheld camera, rapid montage, low resolution, muddy exposure, oversaturated neon, comedy, anime, cartoon, camera shake, chaotic motion, abrupt internal cut, obvious stock footage look, inconsistent protagonist, costume change, face replacement, excessive glitch covering the subject, person, face, city skyline, literal circuit board",
      "order": 1,
      "prompt": "Cinematic music-video shot with no dialogue and no visible text. Persistent visual identity: A melancholic, psychedelic digital afterlife where organic water, bone, glass and fabric merge with restrained computational artifacts. The world feels haunted rather than technological: tactile, wet, slow, elegant and emotionally human. Persistent protagonist: The Quantum Siren: one consistent adult woman with an ageless but clearly adult presence, expressive dark eyes, translucent pale skin with subtle signal fractures, long black hair moving as if underwater, and flowing charcoal fabric. She is never a celebrity, never a real person, and never presented as a literal robot. Narrative intent: Open the film with a quiet impossible world that feels halfway between water and computation.. Shot action and environment: Extreme macro view of one heavy water droplet falling in near darkness, then slowing until it hangs motionless above a black reflective ocean. Inside the droplet, tiny violet signal patterns drift like plankton. The camera makes an almost imperceptible push forward while concentric ripples move below without an obvious source. Palette: midnight black, cold cobalt blue, deep violet, wet silver, rare restrained amber highlights. Camera language: slow deliberate dolly or orbital movement, macro detail alternating with wide negative space, deep parallax, 24 FPS cinematic motion, stable horizon unless the narrative explicitly fractures. Lighting: soft volumetric shafts, underwater caustics, flickering practical light, rim light around translucent edges, controlled highlights with rich shadow detail. Texture and atmosphere: wet glass, fine film grain, subtle analog static, liquid diffraction, bone-white organic architecture, precise but sparse pixel fragmentation. Single continuous shot, coherent anatomy, controlled motion, cinematic depth, no cuts inside the generated clip. Continuity anchors: wet black ocean, violet signal plankton, restrained amber glint.",
      "required": true,
      "resolution": "1080p",
      "reviewNotes": [
        "Droplet must remain coherent.",
        "No text-like symbols inside the droplet.",
        "Reserve empty space for the opening title added later in Resolve if desired."
      ],
      "sampleCount": 1,
      "seed": 18031001,
      "shotId": "shot-001",
      "sourceSectionHints": [
        "intro",
        "ambient opening",
        "low energy"
      ],
      "storageUri": "gs://example-trackprompt-video/trackprompt-video-generation/the-glitch-is-me/shot-001/",
      "title": "Suspended Droplet in the Digital Ocean"
    },
    {
      "aspectRatio": "16:9",
      "chapterId": "digital-ocean",
      "durationSeconds": 8,
      "estimatedCostUsd": 0.8,
      "generateAudio": false,
      "modelId": "veo-3.1-fast-generate-001",
      "negativePrompt": "visible words, captions, subtitles, interface text, logos, watermarks, generic neon cyberpunk city, cyberpunk armor, chrome robot, literal computer monitor UI, singing mouth close-up, lip synchronization, dialogue, microphones with brand marks, extra limbs, malformed hands, duplicated face, face morphing, child, teenager, nudity, sexualized framing, gore, horror monster, jump scare, frantic handheld camera, rapid montage, low resolution, muddy exposure, oversaturated neon, comedy, anime, cartoon, camera shake, chaotic motion, abrupt internal cut, obvious stock footage look, inconsistent protagonist, costume change, face replacement, excessive glitch covering the subject, robot joints, metal body, superhero pose, dramatic mouth movement",
      "order": 2,
      "prompt": "Cinematic music-video shot with no dialogue and no visible text. Persistent visual identity: A melancholic, psychedelic digital afterlife where organic water, bone, glass and fabric merge with restrained computational artifacts. The world feels haunted rather than technological: tactile, wet, slow, elegant and emotionally human. Persistent protagonist: The Quantum Siren: one consistent adult woman with an ageless but clearly adult presence, expressive dark eyes, translucent pale skin with subtle signal fractures, long black hair moving as if underwater, and flowing charcoal fabric. She is never a celebrity, never a real person, and never presented as a literal robot. Narrative intent: Introduce the recurring protagonist as a signal becoming human rather than a robot.. Shot action and environment: Wide underwater-like chamber with no visible walls. The Quantum Siren gradually assembles from silver mist, fine static and transparent ribbons of water, first as a distant silhouette and then as a fully coherent adult woman. Her long black hair and charcoal fabric float gently. She opens her eyes near the end while the camera performs a slow half orbit. Palette: midnight black, cold cobalt blue, deep violet, wet silver, rare restrained amber highlights. Camera language: slow deliberate dolly or orbital movement, macro detail alternating with wide negative space, deep parallax, 24 FPS cinematic motion, stable horizon unless the narrative explicitly fractures. Lighting: soft volumetric shafts, underwater caustics, flickering practical light, rim light around translucent edges, controlled highlights with rich shadow detail. Texture and atmosphere: wet glass, fine film grain, subtle analog static, liquid diffraction, bone-white organic architecture, precise but sparse pixel fragmentation. Single continuous shot, coherent anatomy, controlled motion, cinematic depth, no cuts inside the generated clip. Continuity anchors: Quantum Siren, charcoal floating fabric, translucent signal fractures.",
      "required": true,
      "resolution": "1080p",
      "reviewNotes": [
        "Adult appearance must be unambiguous.",
        "Face and costume become continuity reference for all later Siren shots."
      ],
      "sampleCount": 1,
      "seed": 18031002,
      "shotId": "shot-002",
      "sourceSectionHints": [
        "intro",
        "vocal entrance",
        "awakening"
      ],
      "storageUri": "gs://example-trackprompt-video/trackprompt-video-generation/the-glitch-is-me/shot-002/",
      "title": "The Siren Materializes"
    },
    {
      "aspectRatio": "16:9",
      "chapterId": "the-flicker",
      "durationSeconds": 8,
      "estimatedCostUsd": 0.8,
      "generateAudio": false,
      "modelId": "veo-3.1-fast-generate-001",
      "negativePrompt": "visible words, captions, subtitles, interface text, logos, watermarks, generic neon cyberpunk city, cyberpunk armor, chrome robot, literal computer monitor UI, singing mouth close-up, lip synchronization, dialogue, microphones with brand marks, extra limbs, malformed hands, duplicated face, face morphing, child, teenager, nudity, sexualized framing, gore, horror monster, jump scare, frantic handheld camera, rapid montage, low resolution, muddy exposure, oversaturated neon, comedy, anime, cartoon, camera shake, chaotic motion, abrupt internal cut, obvious stock footage look, inconsistent protagonist, costume change, face replacement, excessive glitch covering the subject, cozy bedroom, furniture clutter, horror asylum, violent strobe",
      "order": 3,